{
  "schema_version": "benchmark-result-1.0.0",
  "run_id": "phase6-q2-comparison-20260816T014417772434Z-91bc350d",
  "timestamp": "2026-08-16T01:44:17.772434Z",
  "git_commit": "94a27359f287ac5915f6b90664aa7e47844f3560",
  "classification": "phase6_quant_comparison_q2",
  "hardware_snapshot": "environment/machine-snapshot-2026-08-15.json",
  "runtime_record": "environment/phase6-comparison-protocol-2026-08-15.json",
  "model_manifest": "environment/phase2-q2-k-xl-download-manifest.json",
  "prompt_suite": "prompts/phase4-baseline.json",
  "benchmark_config": "configs/phase6-q2-comparison.json",
  "python_runtime": {
    "implementation": "CPython",
    "version": "3.13.15",
    "isolated_environment": true,
    "runtime_dependencies": []
  },
  "runtime": {
    "name": "llama.cpp",
    "release_tag": "b10448",
    "commit": "ad1de39e0708e3ced9c71bb3c82d93a2c046a73f",
    "backend": "CUDA",
    "system_fingerprint": "b10448-ad1de39e0"
  },
  "model": {
    "repository": "unsloth/Qwen3.8-27B-GGUF",
    "revision": "1cff334a4a228324d4ee1f76d55d372588f0d556",
    "filename": "Qwen3.8-27B-UD-Q2_K_XL.gguf",
    "quantization": "UD-Q2_K_XL",
    "file_size_bytes": 10676423744,
    "sha256": "46151b52a5cad673d90a00222103254864326c251130b8fc4381d6f34386b3c8",
    "served_alias": "Qwen3.8-27B-UD-Q2_K_XL"
  },
  "configuration": {
    "context_size": 4096,
    "parallel_slots": 1,
    "device": "CUDA0",
    "gpu_layers": -1,
    "fit": "off",
    "flash_attention": "on",
    "prompt_batch_size": 512,
    "prompt_micro_batch_size": 128,
    "threads": 2,
    "threads_batch": 2,
    "kv_cache_k_type": "q8_0",
    "kv_cache_v_type": "q8_0",
    "cache_ram_mib": 0,
    "context_checkpoints": 0,
    "context_shift": false,
    "thinking_mode": false,
    "preserve_thinking": false,
    "reasoning_format": "deepseek",
    "mtp_enabled": false,
    "tools_enabled": false,
    "mcp_enabled": false,
    "vision_enabled": false,
    "max_output_tokens": 256,
    "temperature": 0.6,
    "top_p": 0.95,
    "top_k": 20,
    "min_p": 0.0,
    "seed": 42,
    "prompt_cache": false
  },
  "methodology": {
    "warmup_runs": 1,
    "measured_repetitions": 3,
    "streaming": true,
    "ttft_definition": "Elapsed wall time from HTTP send until the first non-empty assistant content delta was read.",
    "total_latency_definition": "Elapsed wall time from HTTP send through the SSE done marker.",
    "prompt_cache_disabled": true,
    "telemetry_target_interval_milliseconds": 250,
    "telemetry_scope": "NVIDIA GPU 0 plus the selected llama-server process",
    "inter_run_delay_seconds": 2.0
  },
  "server_preflight": {
    "status": "passed",
    "checks": {
      "health_ok": true,
      "model_alias_present": true,
      "context_size_matches": true,
      "parallel_slots_match": true,
      "model_path_matches_manifest": true
    },
    "served_model_alias": "Qwen3.8-27B-UD-Q2_K_XL"
  },
  "runs": [
    {
      "run_label": "warmup-1",
      "warmup": true,
      "repetition": 1,
      "status": "completed",
      "error": null,
      "client_measurements": {
        "response_headers_ms": 2.341,
        "time_to_first_content_token_ms": 137.278,
        "total_latency_ms": 6843.841
      },
      "server_measurements": {
        "usage": {
          "completion_tokens": 256,
          "prompt_tokens": 84,
          "total_tokens": 340,
          "prompt_tokens_details": {
            "cached_tokens": 0
          }
        },
        "timings": {
          "cache_n": 0,
          "prompt_n": 84,
          "prompt_ms": 134.849,
          "prompt_per_token_ms": 1.605345238095238,
          "prompt_per_second": 622.9189686241649,
          "predicted_n": 256,
          "predicted_ms": 6706.537,
          "predicted_per_token_ms": 26.300145098039216,
          "predicted_per_second": 38.02260391614927
        },
        "system_fingerprint": "b10448-ad1de39e0"
      },
      "response": {
        "finish_reason": "length",
        "content": "The lifecycle of a database transaction is a meticulously orchestrated sequence of events designed to guarantee the ACID properties, specifically atomicity, consistency, isolation, and durability. The process begins with validation, a phase that is often misunderstood as a simple check of syntax but is in reality a complex verification of semantic correctness and resource availability. When a transaction initiates, the database engine must first determine if the operation is legally permissible within the current state of the database. This involves checking that the user has the necessary privileges to perform the specific operations, such as reading or writing particular tables. Furthermore, the system validates the logical consistency of the request against the current schema. For instance, if a transaction attempts to insert a record into a table that does not exist, or if it references a column that has been dropped, the validation phase will immediately reject the transaction. Beyond structural checks, the validation layer often performs pre-checks on constraints that can be verified without accessing heavy shared resources. This might include verifying that a primary key does not already exist in a highly indexed structure, although some systems defer this check until the write phase to reduce overhead. Crucially, the validation phase also involves checking the isolation level and the state of any existing locks held by the transaction, ensuring that the transaction does not violate",
        "reasoning_content": null
      },
      "telemetry_summary": {
        "target_interval_milliseconds": 250,
        "sample_count": 28,
        "observed_span_milliseconds": 6828.478,
        "observed_mean_interval_milliseconds": 252.907,
        "observed_minimum_interval_milliseconds": 250.999,
        "observed_maximum_interval_milliseconds": 254.508,
        "peak_vram_used_mib": 10572.0,
        "minimum_vram_free_mib": 1423.0,
        "peak_gpu_utilization_percent": 99.0,
        "peak_gpu_temperature_c": 66.0,
        "peak_gpu_power_draw_w": 253.24,
        "peak_process_working_set_bytes": 10667171840.0,
        "peak_process_private_memory_bytes": 11989086208.0,
        "peak_process_cpu_percent_of_machine": 3.962
      },
      "telemetry_samples": [
        {
          "timestamp_utc": "2026-08-16T01:44:17.855768Z",
          "monotonic_elapsed_milliseconds": 0.089,
          "target_process_id": 7588,
          "process_running": true,
          "gpu": {
            "vram_total_mib": 12282,
            "vram_used_mib": 10554,
            "vram_free_mib": 1441,
            "utilization_percent": 0,
            "temperature_c": 44,
            "power_draw_w": 32.75
          },
          "process": {
            "working_set_bytes": 10524315648,
            "private_memory_bytes": 11806466048,
            "cpu_total_seconds": 3.296875,
            "cpu_percent_of_machine": null
          }
        },
        {
          "timestamp_utc": "2026-08-16T01:44:18.123856Z",
          "monotonic_elapsed_milliseconds": 253.054,
          "target_process_id": 7588,
          "process_running": true,
          "gpu": {
            "vram_total_mib": 12282,
            "vram_used_mib": 10572,
            "vram_free_mib": 1423,
            "utilization_percent": 0,
            "temperature_c": 44,
            "power_draw_w": 32.75
          },
          "process": {
            "working_set_bytes": 10662264832,
            "private_memory_bytes": 11984470016,
            "cpu_total_seconds": 3.53125,
            "cpu_percent_of_machine": 3.309
          }
        },
        {
          "timestamp_utc": "2026-08-16T01:44:18.376043Z",
          "monotonic_elapsed_milliseconds": 505.037,
          "target_process_id": 7588,
          "process_running": true,
          "gpu": {
            "vram_total_mib": 12282,
            "vram_used_mib": 10572,
            "vram_free_mib": 1423,
            "utilization_percent": 99,
            "temperature_c": 58,
            "power_draw_w": 87.85
          },
          "process": {
            "working_set_bytes": 10662305792,
            "private_memory_bytes": 11984474112,
            "cpu_total_seconds": 3.796875,
            "cpu_percent_of_machine": 3.765
          }
        },
        {
          "timestamp_utc": "2026-08-16T01:44:18.627426Z",
          "monotonic_elapsed_milliseconds": 757.583,
          "target_process_id": 7588,
          "process_running": true,
          "gpu": {
            "vram_total_mib": 12282,
            "vram_used_mib": 10572,
            "vram_free_mib": 1423,
            "utilization_percent": 99,
            "temperature_c": 58,
            "power_draw_w": 87.85
          },
          "process": {
            "working_set_bytes": 10662346752,
            "private_memory_bytes": 11984474112,
            "cpu_total_seconds": 4.046875,
            "cpu_percent_of_machine": 3.535
          }
        },
        {
          "timestamp_utc": "2026-08-16T01:44:18.865444Z",
          "monotonic_elapsed_milliseconds": 1009.574,
          "target_process_id": 7588,
          "process_running": true,
          "gpu": {
            "vram_total_mib": 12282,
            "vram_used_mib": 10572,
            "vram_free_mib": 1423,
            "utilization_percent": 99,
            "temperature_c": 61,
            "power_draw_w": 186.58
          },
          "process": {
            "working_set_bytes": 10662461440,
            "private_memory_bytes": 11984564224,
            "cpu_total_seconds": 4.28125,
            "cpu_percent_of_machine": 3.322
          }
        },
        {
          "timestamp_utc": "2026-08-16T01:44:19.118952Z",
          "monotonic_elapsed_milliseconds": 1263.083,
          "target_process_id": 7588,
          "process_running": true,
          "gpu": {
            "vram_total_mib": 12282,
            "vram_used_mib": 10571,
            "vram_free_mib": 1424,
            "utilization_percent": 99,